<?xml version="1.0" encoding="UTF-8"?>
<!DOCTYPE vehicles SYSTEM "nv_stations.dtd">

<stations>
    <station name="Hauptbahnhof">
        <stationTypes>
            <type name="bus"/>
            <type name="subway"/>
			<type name="tram" />
			<type name="city_train" />
        </stationTypes>
        <street name="Bahnhofsplatz"/>
        <ticketMachines>
            <ticketMachine id="TM1" />
        </ticketMachines>
    </station>

</stations>
